{
  "schema_version": "0.1",
  "scenario_id": "basic_room_001",
  "explanation_id": "ai_explanation_001",
  "language": "es",
  "audience_level": "firefighter",
  "summary": "El incendio en la habitación ha evolucionado con un aumento en la ventilación, el HRR y la temperatura, lo que ha provocado un descenso de la capa de humo. La apertura de la puerta ha sido la causa principal del aumento de ventilación, lo que ha contribuido al incremento del HRR y a la elevación de la temperatura. El descenso de la capa de humo se debe a la disminución de la presión en la habitación, lo que ha facilitado la salida de la humo.",
  "explanation": "El aumento de ventilación se debe a la apertura de la puerta, lo que ha permitido que más aire fresco ingresara en la habitación. Este cambio ha provocado un incremento del HRR, lo que se refleja en un aumento de la temperatura en la capa superior de la habitación. El descenso de la capa de humo se debe a la disminución de la presión en la habitación, lo que ha facilitado la salida de la humo. La apertura de la puerta es la causa principal del aumento de ventilación, lo que ha contribuido al incremento del HRR y a la elevación de la temperatura. No se ha establecido una causa física directa entre la apertura de la puerta y el descenso de la capa de humo, ya que esta relación se ha detectado por el motor físico. No se ha afirmado flashover, backdraft o rollover, ya que no existen los correspondientes eventos. La explicación se basa en los datos detectados por el motor físico y el analizador de eventos.",
  "confidence": 0.95,
  "event_ids": [
    "ventilation_increase_180_room_01",
    "hrr_increase_195_room_01",
    "temperature_increase_195_room_01",
    "smoke_layer_descent_195_room_01"
  ],
  "limitations": [
    "No se ha establecido una causa física directa entre la apertura de la puerta y el descenso de la capa de humo.",
    "No se ha afirmado flashover, backdraft o rollover, ya que no existen los correspondientes eventos.",
    "No se ha explicado por qué desciende la capa de humo, salvo que los datos proporcionados permitan establecer esa causa."
  ],
  "source_ids": []
}