{
  "schema_version": "0.1",
  "scenario_id": "basic_room_001",
  "explanation_id": "instructor_explanation_001",
  "language": "es",
  "audience_level": "instructor",
  "summary": "Durante la simulación se registró la siguiente secuencia: El elemento door_01 se abrió en t=180 s. El Fire Event Analyzer detectó un aumento de ventilación asociado a la apertura de door_01. El HRR aumentó de 720 a 1280 kW. La interfaz entre capas descendió de 1.4 a 1.2 m. La temperatura de la capa superior aumentó de 390 a 475 °C.",
  "explanation": "QUÉ OCURRIÓ EN LA SIMULACIÓN:\nEl elemento door_01 se abrió en t=180 s. El Fire Event Analyzer detectó un aumento de ventilación asociado a la apertura de door_01. El HRR aumentó de 720 a 1280 kW. La interfaz entre capas descendió de 1.4 a 1.2 m. La temperatura de la capa superior aumentó de 390 a 475 °C.\n\nCONCEPTOS RELACIONADOS:\nInfluencia de la ventilación en el desarrollo del incendio: La ventilación es uno de los factores que condicionan el desarrollo de un incendio en un recinto. Cuando la disponibilidad de oxígeno es insuficiente para mantener la combustión potencial del combustible presente, el incendio puede quedar limitado por ventilación. En esas condiciones, la reducción de oxígeno puede disminuir la tasa de liberación de calor y la temperatura. La apertura de una puerta, ventana u otra vía de ventilación puede modificar el suministro de oxígeno y producir cambios importantes en el comportamiento del incendio. Sin embargo, en el análisis de una simulación concreta no debe atribuirse automáticamente un cambio de HRR o temperatura a una apertura únicamente por proximidad temporal; esa relación debe estar respaldada por los datos y por el Fire Event Analyzer.\n\nDefinición y significado de la tasa de liberación de calor: La tasa de liberación de calor o HRR representa la velocidad a la que un incendio libera energía. Es una medida de potencia y se expresa normalmente en vatios, kilovatios o megavatios. El HRR no debe confundirse con la temperatura: dos fuegos pueden presentar temperaturas de llama similares y, sin embargo, liberar cantidades de energía por unidad de tiempo muy diferentes. En el análisis de una simulación, un aumento del HRR indica que ha aumentado la tasa de liberación de energía del incendio, pero ese aumento por sí solo no demuestra cuál ha sido su causa.\n\nTemperatura de las capas en un modelo de dos zonas: En un modelo de incendios de dos zonas, el recinto se representa mediante una capa superior y una capa inferior, cada una con una temperatura media calculada. La temperatura de la capa superior representa el estado térmico medio de los gases de esa zona y no debe interpretarse como temperatura de llama. Un aumento de la temperatura de la capa superior indica que los gases de esa capa han aumentado su temperatura media durante el intervalo analizado. Ese incremento, por sí solo, no permite determinar cuál ha sido su causa física concreta; para establecerla deben analizarse conjuntamente el HRR, la ventilación, los flujos de gases, las pérdidas térmicas y otros datos disponibles.\n\nInterfaz entre capas en un modelo de dos zonas: En un modelo de incendios de dos zonas, cada recinto se representa mediante una capa superior y una capa inferior de gases. La altura de la interfaz indica la separación vertical entre ambas capas. Un descenso de la interfaz significa que la capa superior ocupa una mayor parte de la altura del recinto. Este cambio puede utilizarse para describir la evolución de la estratificación de gases y humo dentro del compartimento. Sin embargo, el descenso de la interfaz por sí solo no identifica la causa física concreta que lo ha producido; esa interpretación requiere analizar conjuntamente otros datos de la simulación.\n\nQUÉ NO PODEMOS CONCLUIR:\nLos datos disponibles no son suficientes para afirmar que la apertura de la puerta causó por sí sola el aumento del HRR. Los datos disponibles no son suficientes para afirmar una relación causal directa entre la apertura de la puerta y el aumento de temperatura. Se ha detectado un descenso de la interfaz entre capas, pero los datos disponibles no permiten atribuirle una causa física concreta.",
  "confidence": 0.9,
  "event_ids": [
    "ventilation_increase_180_room_01",
    "hrr_increase_195_room_01",
    "smoke_layer_descent_195_room_01",
    "temperature_increase_195_room_01"
  ],
  "source_ids": [
    "NIST_FIRE_DYNAMICS",
    "NIST_CFAST_V7",
    "NIST_CFAST_V7_TECHNICAL_REFERENCE"
  ],
  "limitations": [
    "Los datos disponibles no son suficientes para afirmar que la apertura de la puerta causó por sí sola el aumento del HRR.",
    "Los datos disponibles no son suficientes para afirmar una relación causal directa entre la apertura de la puerta y el aumento de temperatura.",
    "Se ha detectado un descenso de la interfaz entre capas, pero los datos disponibles no permiten atribuirle una causa física concreta."
  ]
}